id,name,price_per_night,capacity,distance_to_sea,amenities,is_available
1,Лесной домик,2500,4,800,"санузел, душевая кабина",true
2,Озерный шале,3200,6,1200,"санузел, душевая кабина, баня",true
3,Горный приют,1800,2,1500,"никаких",true
4,Семейный коттедж,4500,8,500,"санузел, душевая кабина, кухня, детская площадка",false
5,Романтическое гнездышко,2900,2,300,"санузел, джакузи, кондиционер",true
6,Эко-дом,2200,4,600,"санузел, душевая кабина, эко-материалы",true
7,Лукоморье,3800,6,400,"санузел, душевая кабина, русская печь",true
8,Мини-отель,5000,10,200,"санузел, душевая кабина, кухня, Wi-Fi, парковка",true